{
  "id": "low-cloud-underestimate",
  "name": "Low Cloud Underestimate",
  "version": "1.0",
  "last_updated": "2026-04-16",
  "category": "clouds",
  "region": "eastern_subtropical_oceans",
  "season": "annual",
  "affected_variables": [],
  "description": "Draft description placeholder for Low Cloud Underestimate.",
  "persistence": "longstanding",
  "cmip_history": [],
  "severity_by_model": {},
  "implicated_params": [],
  "fix_attempts": [],
  "cascade_links": [],
  "disputed_mechanisms": [],
  "citations": [
    {
      "authors": "Bias Atlas Working Group",
      "year": 2026,
      "journal": "Bias Atlas Placeholder Bibliography",
      "doi": "10.0000/atlas-bias.low-cloud-underestimate",
      "relevance": "Placeholder citation for scaffold stage; replace with peer-reviewed source."
    }
  ],
  "feedback_history": [],
  "changelog": []
}